ID;Title;URL;Actual Price;Old Price;Base Price;Courier Price;Subscribe Price;Single Item Pack Discount Price;Whole Pack Discount Price;Whole Pack Without Discount Price;Brand
117425;Adult Grain Free Сухой корм беззерновой для взрослых собак, с ягненком, 3 кг;https://old.4lapy.ru/catalog/sobaki/korm-sobaki/sukhoy-korm-sobaki/ownat-gf-just-korm-suhoy-dlya-vzroslyh-sobak-s-yagnenkom-14-kg.html;2729;0;0;0;0;0;0;0;Ownat
155309;Grain Free Hypoallergenic Корм сухой гипоаллергенный для собак с лососем, 3 кг;https://old.4lapy.ru/catalog/sobaki/korm-sobaki/sukhoy-korm-sobaki/gf-hypo-korm-suhoy-gipoallergennyy-dlya-sobak-s-lososem-3-kg.html;4329;0;0;0;0;0;0;0;Ownat
151181;Mini Grain Free Сухой корм беззерновой для собак мелких пород, с ягненком, 400 гр.;https://old.4lapy.ru/catalog/sobaki/korm-sobaki/sukhoy-korm-sobaki/prime-korm-dlya-sobak-melkih-porod-bezzernovoy-s-yagnenkom.html;695;0;0;0;0;0;0;0;Ownat
112537;Сухой корм для взрослых собак мелких пород, ягненок с индейкой, 1 кг;https://old.4lapy.ru/catalog/sobaki/korm-sobaki/sukhoy-korm-sobaki/suhoy-korm-grandorf-dlya-vzroslyh-sobak-melkih-porod-yagnenok-s-risom-1kg.html;1599;0;0;0;0;0;0;0;Grandorf
135841;Hypoallergenic Гипоаллергенный сухой корм для собак всех пород, ягненок, 2,7 кг;https://old.4lapy.ru/catalog/sobaki/korm-sobaki/sukhoy-korm-sobaki/gipoallergennyy-suhoy-korm-dlya-sobak-vseh-porod-yagnenok-11-2kg.html;4299;0;0;0;0;0;0;0;Grandin
112549;Сухой корм для взрослых собак мелких пород, четыре вида мяса, 1 кг;https://old.4lapy.ru/catalog/sobaki/korm-sobaki/sukhoy-korm-sobaki/suhoy-korm-grandorf-dlya-vzroslyh-sobak-melkih-porod-chetyre-vida-myasa-s-burym-risom-1kg.html;1735;0;0;0;0;0;0;0;Grandorf
112546;Сухой корм для взрослых собак средних и крупных пород, кролик с индейкой, 1 кг;https://old.4lapy.ru/catalog/sobaki/korm-sobaki/sukhoy-korm-sobaki/suhoy-korm-grandorf-dlya-vzroslyh-sobak-vseh-porod-krolik-s-kartofelem-1kg.html;1735;0;0;0;0;0;0;0;Grandorf
42416;Mini Puppy Сухой корм для щенков мелких пород в возрасте от 2 до 10 месяцев, 800 гр.;https://old.4lapy.ru/catalog/sobaki/korm-sobaki/sukhoy-korm-sobaki/Royal_Canin_Mini_Junior_33_suhoy_korm_dlya_shchenkov_melkih_porod.html;785;0;0;0;0;0;0;0;Royal Canin
140361;Adult Classic Сухой корм для собак, с уткой, 4 кг;https://old.4lapy.ru/catalog/sobaki/korm-sobaki/sukhoy-korm-sobaki/ownat-classic-korm-sukhoy-dlya-sobak-s-utkoy.html;2379;0;0;0;0;0;0;0;Ownat
42418;Mini Adult Сухой корм для взрослых собак мелких размеров в возрасте от 10 месяцев до 8 лет, 800 гр.;https://old.4lapy.ru/catalog/sobaki/korm-sobaki/sukhoy-korm-sobaki/Royal_Canin_Mini_Adult_27_suhoy_korm_dlya_sobak_melkih_porodr.html;675;0;0;0;0;0;0;0;Royal Canin
124638;Adult Grain Free Сухой корм для взрослых собак, с уткой, 3 кг;https://old.4lapy.ru/catalog/sobaki/korm-sobaki/sukhoy-korm-sobaki/ownat-gf-just-korm-suhoy-dlya-vzroslyh-sobak-s-utkoy-14-kg.html;2859;0;0;0;0;0;0;0;Ownat
48996;Sensitive Digestion Сухой корм для взрослых собак для мелких и карликовых пород с чувствительным пищеварением, с высоким содержанием ягненка, 700 гр.;https://old.4lapy.ru/catalog/sobaki/korm-sobaki/sukhoy-korm-sobaki/Pro_Plan_suhoy_korm_dlya_sobak_melkih_i_karlikovyh_porod_s_chuvstvit_pishchevaren_yagnenokg.html;679;0;0;0;0;0;0;0;PRO PLAN®
163800;Сухой корм полнорационный для взрослых собак всех пород с чувствительным пищеварением, индейка и рис, 3 кг;https://old.4lapy.ru/catalog/sobaki/korm-sobaki/sukhoy-korm-sobaki/korm-suhoy-polnoracionnyy-dlya-vzroslyh-sobak-vseh-porod-s-chuvstvitelnym-pishchevareniem-indeyka-i-ris-3-kg1.html;1699;0;0;0;0;0;0;0;Aвва
147001;Regional Ocean Сухой корм для собак, с лососем и треской, 2 кг;https://old.4lapy.ru/catalog/sobaki/korm-sobaki/sukhoy-korm-sobaki/regional-ocean-korm-suhoy-dlya-sobak.html;1949;0;0;0;0;0;0;0;Dog & Dog Wild
113399;Medium Sterilized Ultra Сухой корм для стерилизованных собак средних пород, 3 кг;https://old.4lapy.ru/catalog/sobaki/korm-sobaki/sukhoy-korm-sobaki/ownat-ultra-dlya-sterilizovannyh-sobak-srednih-porod-3-kg.html;3359;0;0;0;0;0;0;0;Ownat
154315;Сухой корм на основе свежего мяса для щенков мелких пород, с индейкой, 400 гр.;https://old.4lapy.ru/catalog/sobaki/korm-sobaki/sukhoy-korm-sobaki/sukhoy-korm-na-osnove-svezhego-myasa-dlya-shchenkov-melkikh-porod-s-indeykoy-400g.html;409;0;0;0;0;0;0;0;Aвва
42359;Sensitive Digestion Сухой корм для взрослых собак средних пород с чувствительным пищеварением, с ягненком, 1,5 кг;https://old.4lapy.ru/catalog/sobaki/korm-sobaki/sukhoy-korm-sobaki/Pro_Plan_Adult_suhoy_korm_dlya_sobak_s_chuvstvitelnym_pishchevareniem_yagnenokris.html;1235;0;0;0;0;0;0;0;PRO PLAN®
112543;Сухой корм для взрослых собак крупных пород, ягненок с индейкой, 3 кг;https://old.4lapy.ru/catalog/sobaki/korm-sobaki/sukhoy-korm-sobaki/suhoy-korm-grandorf-dlya-vzroslyh-sobak-krupnyh-porod-yagnenok-s-risom-3kg.html;3815;0;0;0;0;0;0;0;Grandorf
117414;Natural Ingredients Сухой корм для взрослых собак с ягненком и рисом, 3 кг;https://old.4lapy.ru/catalog/sobaki/korm-sobaki/sukhoy-korm-sobaki/avva-korm-dlya-vzroslyh-sobak-s-yagnenkom-i-risom-mesh-12kg.html;1614;0;0;0;0;0;0;0;Aвва
42428;X-Small Puppy Сухой корм для щенков миниатюрных пород в возрасте от 2 до 10 месяцев, 500 гр.;https://old.4lapy.ru/catalog/sobaki/korm-sobaki/sukhoy-korm-sobaki/Royal_Caninmall_korm_suhoy_korm_dlya_shchenkov_ot_2_do_10_mes.html;537;0;0;0;0;0;0;0;Royal Canin
146998;Natural Instinct Сухой корм для щенков, с лососем и уткой, 2 кг;https://old.4lapy.ru/catalog/sobaki/korm-sobaki/sukhoy-korm-sobaki/natural-instinct-korm-suhoy-dlya-shchenkov.html;1899;0;0;0;0;0;0;0;Dog & Dog Wild
140809;Holistic Сухой корм для собак средних и крупных пород, с ягненком, 2,7 кг;https://old.4lapy.ru/catalog/sobaki/korm-sobaki/sukhoy-korm-sobaki/holistic-suhoy-korm-dlya-sobak-srednih-i-krupnyh-porod-s-yagnenkom-11-2-kg.html;3499;0;0;0;0;0;0;0;Grandin
42360;Sensitive Digestion Сухой корм для щенков средних пород с чувствительным пищеварением, с ягненком, 1,5 кг;https://old.4lapy.ru/catalog/sobaki/korm-sobaki/sukhoy-korm-sobaki/Pro_Plan_Puppy_suhoy_korm_dlya_shchenkov_s_chuvstvitelnym_pishchevareniem_yagnenok.html;1235;0;0;0;0;0;0;0;PRO PLAN®
117434;Medium Adult Ultra Сухой корм для собак средних пород, с ягненком и рисом, 3 кг;https://old.4lapy.ru/catalog/sobaki/korm-sobaki/sukhoy-korm-sobaki/ownat-ultra-korm-dlya-sobak-srednih-porod-s-yagnenkom-i-risom-pak-3kg.html;3199;0;0;0;0;0;0;0;Ownat
145781;Adult Care Dermatologic Сухой корм для собак всех пород склонных к дерматологической чувствительности, с лососем, 3 кг;https://old.4lapy.ru/catalog/sobaki/korm-sobaki/sukhoy-korm-sobaki/ownat-care-dlya-sobak-vseh-porod-dermatologic-s-lososem-pak-3kg.html;3459;0;0;0;0;0;0;0;Ownat
173442;Holistic Adult Medium & Maxi Сухой корм для собак средних и крупных пород, с ягненком и индейкой, 1 кг;https://old.4lapy.ru/catalog/sobaki/korm-sobaki/sukhoy-korm-sobaki/suhoy-korm-grandorf-dlya-vzroslyh-sobak-vseh-porod-yagnenok-s-risom-3kg.html;1599;0;0;0;0;0;0;0;Grandorf
79898;Maxi Puppy Сухой корм для щенков крупных пород в возрасте от 2 до 15 месяцев, 3 кг;https://old.4lapy.ru/catalog/sobaki/korm-sobaki/sukhoy-korm-sobaki/Royal_Canin_Maxi_Junior_32_korm_suhoy_korm_dlya_shchenkov_krupnyh_porod_do_15_mesyatsev.html;2457;0;0;0;0;0;0;0;Royal Canin
137914;Premium Dog Sensitive Корм для взрослых собак всех пород с чувствительным пищеварением, с ягненком и индейкой, 1 кг;https://old.4lapy.ru/catalog/sobaki/korm-sobaki/sukhoy-korm-sobaki/korm-suhoy-dlya-vzroslyh-sobak-vseh-porod-chuvstvitelnoe-pishchevarenie-yagnenok-indeyka.html;639;0;0;0;0;0;0;0;Brit
151187;Mini Adult Ultra Сухой корм для собак мелких пород, с курицей и индейкой, 400 гр.;https://old.4lapy.ru/catalog/sobaki/korm-sobaki/sukhoy-korm-sobaki/ultra-korm-dlya-sobak-melkih-porod-s-kuricey-i-indeykoy.html;559;0;0;0;0;0;0;0;Ownat
46867;Sensitive Skin Сухой корм для взрослых собак мелких и карликовых пород с чувствительной кожей, с высоким содержанием лосося, 700 гр.;https://old.4lapy.ru/catalog/sobaki/korm-sobaki/sukhoy-korm-sobaki/Pro_Plan_Adultall_suhoy_korm_dlya_sobak_melkih_porod_s_chuvstvitelnoy_kogeyososris.html;719;0;0;0;0;0;0;0;PRO PLAN®
113395;Adult Grain Free Сухой корм для взрослых собак, с курицей, 3 кг;https://old.4lapy.ru/catalog/sobaki/korm-sobaki/sukhoy-korm-sobaki/ownat-gf-just-s-kuricey-dlya-vzroslyh-sobak-3-kg.html;2629;0;0;0;0;0;0;0;Ownat
151185;Mini Junior Ultra Корм сухой для щенков мелких пород, с курицей и индейкой, 400 гр.;https://old.4lapy.ru/catalog/sobaki/korm-sobaki/sukhoy-korm-sobaki/ultra-korm-dlya-shchenkov-melkih-porod-s-kuricey-i-indeykoy.html;559;0;0;0;0;0;0;0;Ownat
117429;Maxi Adult Ultra Сухой корм для собак крупных пород, с курицей и индейкой, 3 кг;https://old.4lapy.ru/catalog/sobaki/korm-sobaki/sukhoy-korm-sobaki/ownat-ultra-korm-dlya-sobak-krupnyh-porod-s-kuricey-i-indeykoy-pak-3kg.html;2999;0;0;0;0;0;0;0;Ownat
163788;Grain Free Сухой корм беззерновой для взрослых собак всех пород, с ягнёнком и картофелем, 3 кг;https://old.4lapy.ru/catalog/sobaki/korm-sobaki/sukhoy-korm-sobaki/korm-suhoy-bezzernovoy-na-osnove-svezhego-myasa-dlya-vzroslyh-sobak-vsehporod-s-yagnenkom-i-kartofelem-3-kg.html;1719;0;0;0;0;0;0;0;Aвва
49399;X-Small Adult Сухой корм для миниатюрных собак от 10 месяцев до 8 лет, 500 гр.;https://old.4lapy.ru/catalog/sobaki/korm-sobaki/sukhoy-korm-sobaki/Royal_Caninmall_Adult_korm_suhoy_dlya_vzroslyh_sobak_vesom_do.html;495;0;0;0;0;0;0;0;Royal Canin
154317;Сухой корм на основе свежего мяса для взрослых собак мелких пород, с ягненком, 400 гр.;https://old.4lapy.ru/catalog/sobaki/korm-sobaki/sukhoy-korm-sobaki/sukhoy-korm-na-osnove-svezhego-myasa-dlya-vzroslykh-sobak-melkikh-porod-s-yagnenkom-400g.html;409;0;0;0;0;0;0;0;Aвва
84191;Medium Adult Сухой корм для собак средних размеров в возрасте от 12 месяцев до 7 лет, 3 кг;https://old.4lapy.ru/catalog/sobaki/korm-sobaki/sukhoy-korm-sobaki/Royal_Canin_Medium_Adult_suhoy_korm_dlya_sobak_srednih_porod_ves_vzrosloy_osobi_ot_11_kg_do_25.html;2089;0;0;0;0;0;0;0;Royal Canin
145778;Adult Care digestive Сухой корм для собак всех пород с чувствительным пищеварением, с курицей, 3 кг;https://old.4lapy.ru/catalog/sobaki/korm-sobaki/sukhoy-korm-sobaki/ownat-care-korm-dlya-sobak-vseh-porod-digestive-s-kuricey-pak-3kg.html;3175;0;0;0;0;0;0;0;Ownat
173458;Holistic Adult Medium & Maxi Сухой корм для собак средних и крупных пород, 4 вида мяса с пробиотиками, 1 кг;https://old.4lapy.ru/catalog/sobaki/korm-sobaki/sukhoy-korm-sobaki/korm-suhoy-dlya-sobak-srednih-i-krupnyh-porod-4-vida-myasa-s-probiotikami-1-kg.html;1735;0;0;0;0;0;0;0;Grandorf
148087;Premium Adult Сухой корм для собак всех пород, ягненок и рис, 2 кг;https://old.4lapy.ru/catalog/sobaki/korm-sobaki/sukhoy-korm-sobaki/avva-premium-suh-2kg-dlya-sobak-vseh-porod-yagnenok-i-ris.html;1269;0;0;0;0;0;0;0;Aвва
82143;All Breeds Hypoallergenic корм для взрослых собак, склонных к аллергическим реакциям и расстройствам пищеварения, с лососем и тунцом, 12 кг;https://old.4lapy.ru/catalog/sobaki/korm-sobaki/sukhoy-korm-sobaki/monge-dog-speciality-hypoallergenic-korm-dlya-sobak-gipoallergennyy-losos1.html;10707;0;0;0;0;0;0;0;Monge
173440;Holistic Adult Mini Сухой корм для собак мелких пород, с индейкой, 1 кг;https://old.4lapy.ru/catalog/sobaki/korm-sobaki/sukhoy-korm-sobaki/korm-suhoy-dlya-sobak-melkih-porod-s-indeykoy-1-kg.html;1599;0;0;0;0;0;0;0;Grandorf
169242;Adult Monoprotein Сухой корм для собак средних и крупных пород, белая рыба, 2 кг;https://old.4lapy.ru/catalog/sobaki/korm-sobaki/sukhoy-korm-sobaki/korm-suhoy-dlya-sobak-srednih-i-krupnyh-porod-belaya-ryba.html;1849;0;0;0;0;0;0;0;AlphaPet
156030;Премиум Сухой корм для собак с чувствительным пищеварением, лосось и индейка, 1 кг;https://old.4lapy.ru/catalog/sobaki/korm-sobaki/sukhoy-korm-sobaki/premium-suhoy-korm-dlya-sobak-s-chuvstvitelnym-pishchevareniem-losos-i-indeyka-1kg.html;639;0;0;0;0;0;0;0;Brit
169458;Adult Сухой корм для собак всех пород, с ягненком и рисом, 3 кг;https://old.4lapy.ru/catalog/sobaki/korm-sobaki/sukhoy-korm-sobaki/korm-dlya-sobak-vseh-porod-yagnenok-i-ris-3kg.html;1599;0;0;0;0;0;0;0;Aвва
151183;Prime Mini Корм сухой беззерновой для собак мелких пород, с курицей и индейкой, 400 гр.;https://old.4lapy.ru/catalog/sobaki/korm-sobaki/sukhoy-korm-sobaki/gf-prime-korm-suhoy-dlya-sobak-melkih-porod-s-kuricey-i-indeykoy.html;679;0;0;0;0;0;0;0;Ownat
86933;Maxi Adult 26 Сухой корм для собак крупных размеров в возрасте от 15 месяцев до 5 лет, 3 кг;https://old.4lapy.ru/catalog/sobaki/korm-sobaki/sukhoy-korm-sobaki/Royal_Canin_Maxi_Adult_26_suhoy_korm_dlya_sobak_krupnyh_porod.html;2335;0;0;0;0;0;0;0;Royal Canin
42403;Chihuahua Adult Сухой корм для собак породы чихуахуа старше 8 месяцев, 500 гр.;https://old.4lapy.ru/catalog/sobaki/korm-sobaki/sukhoy-korm-sobaki/Royal_Canin_28_Adult_suhoy_korm_dlya_sobak_porody_CHihuahua.html;577;0;0;0;0;0;0;0;Royal Canin
46864;Healthy Start Сухой корм для щенков мелких и карликовых пород, с высоким содержанием курицы, 700 гр.;https://old.4lapy.ru/catalog/sobaki/korm-sobaki/sukhoy-korm-sobaki/Pro_Plan_Puppyall_suhoy_korm_dlya_shchenkov_melkih_porod_kuritsa_i_ris.html;679;0;0;0;0;0;0;0;PRO PLAN®
110711;Pomeranian Сухой корм для собак породы померанский шпиц, 500 гр.;https://old.4lapy.ru/catalog/sobaki/korm-sobaki/sukhoy-korm-sobaki/korm-suhoy-dlya-sobak-pomeranskiy-shpic.html;577;0;0;0;0;0;0;0;Royal Canin
147007;Regional Farm Сухой корм для собак, с курицей, уткой и кроликом, 2 кг;https://old.4lapy.ru/catalog/sobaki/korm-sobaki/sukhoy-korm-sobaki/regional-farm-korm-suhoy-dlya-sobak.html;1899;0;0;0;0;0;0;0;Dog & Dog Wild
173437;Holistic Junior Medium & Maxi Сухой корм для юниоров всех пород, ягненок с индейкой, 1 кг;https://old.4lapy.ru/catalog/sobaki/korm-sobaki/sukhoy-korm-sobaki/suhoy-korm-grandorf-dlya-yuniorov-vseh-porod-yagnenok-s-risom-3kg.html;1599;0;0;0;0;0;0;0;Grandorf
42414;Mother and Babydog Mini Starter Сухой корм для беременных, кормящих собак мелких пород и для щенков до 2 месяцев, 1 кг;https://old.4lapy.ru/catalog/sobaki/korm-sobaki/sukhoy-korm-sobaki/Royal_Canin_Mini_Starter_korm_suhoy_korm_dlya_shchenkov_melkih_porod_do_2h_mesyatsev.html;1085;0;0;0;0;0;0;0;Royal Canin
146260;Сухой корм для собак крупных пород с говядиной, 3 кг;https://old.4lapy.ru/catalog/sobaki/korm-sobaki/sukhoy-korm-sobaki/korm-suhoy-dlya-sobak-krupnyh-porod-s-govyadinoy.html;2395;0;0;0;0;0;0;0;AlphaPet
42400;Yorkshire Terrier Adult Сухой корм для собак породы йоркширский терьер старше 10 месяцев, 500 гр.;https://old.4lapy.ru/catalog/sobaki/korm-sobaki/sukhoy-korm-sobaki/Royal_Canin_28_Adult_suhoy_korm_dlya_sobak_porody_Yorkshirskiy_terer.html;577;0;0;0;0;0;0;0;Royal Canin
145775;Adult Care mobility Сухой корм для собак всех пород с питательными веществами для поддержки работы суставов, с курицей, 3 кг;https://old.4lapy.ru/catalog/sobaki/korm-sobaki/sukhoy-korm-sobaki/ownat-care-korm-dlya-sobak-vseh-porod-mobility-s-kuricey-pak-3kg.html;3399;0;0;0;0;0;0;0;Ownat
98486;Mini Digestive Care Сухой корм для собак маленьких пород с чувствительным пищеварением, 1 кг;https://old.4lapy.ru/catalog/sobaki/korm-sobaki/sukhoy-korm-sobaki/korm-suhoy-dlya-sobak-mini-porod-daydzhestiv-kea.html;1235;0;0;0;0;0;0;0;Royal Canin
79664;Giant Puppy 34 Сухой корм для щенков гигантских пород в возрасте от 2 до 8 месяцев, 3,5 кг;https://old.4lapy.ru/catalog/sobaki/korm-sobaki/sukhoy-korm-sobaki/giant-puppy-korm-korm-suhoy-dlya-shchenkov-ochen-krupnyh-porod1.html;2469;0;0;0;0;0;0;0;Royal Canin
146253;Сухой корм для щенков мини пород с ягненком и индейкой, 500 г;https://old.4lapy.ru/catalog/sobaki/korm-sobaki/sukhoy-korm-sobaki/korm-suhoy-dlya-shchenkov-mini-porod-s-yagnenkom-i-indeykoy.html;589;0;0;0;0;0;0;0;AlphaPet
146255;Сухой корм для собак мини пород с ягненком и рисом, 500 г;https://old.4lapy.ru/catalog/sobaki/korm-sobaki/sukhoy-korm-sobaki/korm-suhoy-dlya-sobak-mini-porod-s-yagnenkom-i-risom1.html;553;0;0;0;0;0;0;0;AlphaPet
173451;Holistic Adult Medium & Maxi Сухой корм для собак средних и крупных пород, с белой рыбой, 10 кг;https://old.4lapy.ru/catalog/sobaki/korm-sobaki/sukhoy-korm-sobaki/korm-suhoy-dlya-sobak-srednih-i-krupnyh-porod-s-beloy-ryboy-10-kg.html;9825;0;0;0;0;0;0;0;Grandorf
163796;Fresh Meat Сухой корм для взрослых собак всех пород, с ягненком и рисом, 3 кг;https://old.4lapy.ru/catalog/sobaki/korm-sobaki/sukhoy-korm-sobaki/korm-suhoy-na-osnove-svezhego-myasa-dlya-vzroslyh-sobak-vseh-porod-s-yagnenkom-i-risom-3-kg.html;1779;0;0;0;0;0;0;0;Aвва
154321;Senior Сухой корм на основе свежего мяса для собак мелких пород, с индейкой, 400 гр.;https://old.4lapy.ru/catalog/sobaki/korm-sobaki/sukhoy-korm-sobaki/sukhoy-korm-na-osnove-svezhego-myasa-dlya-sobak-senor-melkikh-porod-s-indeykoy-400g.html;409;0;0;0;0;0;0;0;Aвва
98494;Mini Sterilised Сухой корм для стерилизованных собак маленьких пород, 3 кг;https://old.4lapy.ru/catalog/sobaki/korm-sobaki/sukhoy-korm-sobaki/korm-suhoy-dlya-sobak-melkih-porod-sterilayzd.html;3317;0;0;0;0;0;0;0;Royal Canin
44102;Grain Free Adult Сухой корм для собак всех пород старше 1 года, с ягненком и картофелем, 3 кг;https://old.4lapy.ru/catalog/sobaki/korm-sobaki/sukhoy-korm-sobaki/Avva_Premium_Grain_Free_bezzernovoy_suhoy_korm_dlya_sobak_vseh_porod_yagnenokkartofel.html;1719;0;0;0;0;0;0;0;Aвва
151179;Mini Adult Classic Сухой корм для взрослых собак мелких пород, с курицей, 400 гр.;https://old.4lapy.ru/catalog/sobaki/korm-sobaki/sukhoy-korm-sobaki/classic-korm-dlya-sobak-melkih-porod-s-kuricey.html;439;0;0;0;0;0;0;0;Ownat
146284;Корм сухой для взрослых собак, мясной рацион, 2 кг;https://old.4lapy.ru/catalog/sobaki/korm-sobaki/sukhoy-korm-sobaki/korm-suhoy-dlya-vzroslyh-sobak-myasnoy-racion.html;1025;0;0;0;0;0;0;0;Sirius
148078;Premium Adult Сухой корм для собак мелких пород, индейка, 400 гр.;https://old.4lapy.ru/catalog/sobaki/korm-sobaki/sukhoy-korm-sobaki/avva-premium-suh-400g-dlya-sobak-melkih-porod-indeyka.html;349;0;0;0;0;0;0;0;Aвва
42412;Chihuahua Junior Сухой корм для щенков породы чихуахуа до 8 месяцев, 500 гр.;https://old.4lapy.ru/catalog/sobaki/korm-sobaki/sukhoy-korm-sobaki/Royal_Canin_Chihuahua_Junior_suhoy_korm_dlya_sobak_porody_Chihuahua.html;615;0;0;0;0;0;0;0;Royal Canin
146409;Сухой корм для взрослых собак мелких пород, с ягненком, 400 гр.;https://old.4lapy.ru/catalog/sobaki/korm-sobaki/sukhoy-korm-sobaki/fresh-meat-suhoy-korm-dlya-sobak-melkih-porod-s-yagnenkom-1-5-kg.html;549;0;0;0;0;0;0;0;Grandin
42340;Sensitive Skin Сухой корм для взрослых собак средних пород с чувствительной кожей, с высоким содержанием лосося, 3 кг;https://old.4lapy.ru/catalog/sobaki/korm-sobaki/sukhoy-korm-sobaki/medium-adult-sensitive-skin-korm-dlya-sobak-srednih-porod-s-chuvstvitelnoy-kozhey-s-lososem.html;2593;0;0;0;0;0;0;0;PRO PLAN®
42977;Сухой гипоаллергенный корм для собак всех пород старше 1 года, с ягненком и рисом, 3 кг;https://old.4lapy.ru/catalog/sobaki/korm-sobaki/sukhoy-korm-sobaki/Nasha_Marka_suhoy_korm_dlya_sobak_vseh_sobak_yagnenokris.html;775;0;0;0;0;0;0;0;Наша Марка
163792;Fresh Meat Сухой корм для взрослых собак всех пород, с лососем и рисом, 3 кг;https://old.4lapy.ru/catalog/sobaki/korm-sobaki/sukhoy-korm-sobaki/korm-suhoy-na-osnove-svezhego-myasa-dlya-vzroslyh-sobak-vseh-porod-s-lososem-i-risom-3-kg.html;1729;0;0;0;0;0;0;0;Aвва
154319;Сухой корм на основе свежего мяса для взрослых собак мелких пород, с уткой, 400 гр.;https://old.4lapy.ru/catalog/sobaki/korm-sobaki/sukhoy-korm-sobaki/sukhoy-korm-na-osnove-svezhego-myasa-dlya-vzroslykh-sobak-melkikh-porod-s-utkoy-400g.html;409;0;0;0;0;0;0;0;Aвва
146248;WOW Сухой корм для собак средних пород с ягненком и рисом, 2 кг;https://old.4lapy.ru/catalog/sobaki/korm-sobaki/sukhoy-korm-sobaki/korm-suhoy-dlya-sobak-srednih-porod-s-yagnenkom-i-risom.html;1074;0;0;0;0;0;0;0;AlphaPet
110714;Корм сухой для собак старше 8 лет Йоркширский терьер;https://old.4lapy.ru/catalog/sobaki/korm-sobaki/sukhoy-korm-sobaki/korm-suhoy-dlya-sobak-starshe-8-let-yorkshirskiy-terer.html;639;0;0;0;0;0;0;0;Royal Canin
169482;Сухой корм для собак средних и крупных пород, с курицей, 14,5 кг;https://old.4lapy.ru/catalog/sobaki/korm-sobaki/sukhoy-korm-sobaki/korm-suhoy-dlya-sobak-srednih-i-krupnyh-porod-s-kuricey-14-5kg.html;5781;8259;0;0;0;0;0;0;Perfect Fit
147004;Regional Grassland Сухой корм для собак, с мясом кабана, ягненка и буйвола, 2 кг;https://old.4lapy.ru/catalog/sobaki/korm-sobaki/sukhoy-korm-sobaki/regional-grassland-korm-suhoy-dlya-sobak.html;1999;0;0;0;0;0;0;0;Dog & Dog Wild
169240;Adult Monoprotein Сухой корм для собак мелких пород, белая рыба, 500 гр.;https://old.4lapy.ru/catalog/sobaki/korm-sobaki/sukhoy-korm-sobaki/korm-suhoy-dlya-sobak-melkih-porod-s-beloy-ryboy-1-5kg.html;466;0;0;0;0;0;0;0;AlphaPet
42315;Сухой корм для взрослых собак всех пород, с говядиной, 2,2 кг;https://old.4lapy.ru/catalog/sobaki/korm-sobaki/sukhoy-korm-sobaki/Pedigree_suhoy_korm_dlya_vzroslyh_sobak_vseh_porod_govyadina.html;689;0;0;0;0;0;0;0;Pedigree
117411;Natural Ingredients Сухой корм для взрослых собак крупных пород, с курицей, 3 кг;https://old.4lapy.ru/catalog/sobaki/korm-sobaki/sukhoy-korm-sobaki/avva-korm-dlya-vzroslyh-sobak-krupnyh-porod-s-kuricey-mesh-12kg.html;1749;0;0;0;0;0;0;0;Aвва
164076;Care Sensitive Сухой корм для собак всех пород, с индейкой и ягненком, 1,5 кг;https://old.4lapy.ru/catalog/sobaki/korm-sobaki/sukhoy-korm-sobaki/korm-suhoy-dlya-sobak-vseh-porod-s-indeykoy-i-yagnenkom-1-5kg.html;1499;0;0;0;0;0;0;0;Brit
